subreddit,post_id,sentence_range,text,label,syntax_fk_grade,Stress Level
ptsd,8601tu,"(15, 20)","He said he had not felt that way before, suggeted I go rest and so ..TRIGGER AHEAD IF YOUI'RE A HYPOCONDRIAC LIKE ME: i decide to look up ""feelings of doom"" in hopes of maybe getting sucked into some rabbit hole of ludicrous conspiracy, a stupid ""are you ",1,3.253572568,-0.002741703
assistance,8lbrx9,"(0, 5)","Hey there r/assistance, Not sure if this is the right place to post this.. but here goes =) I'm currently a student intern at Sandia National Labs and working on a survey to help improve our marketing outreach efforts at the many schools we recruit at aro",0,8.828315789,0.292857143
ptsd,9ch1zh,"(15, 20)","My mom then hit me with the newspaper and it shocked me that she would do this, she knows I don't like play hitting, smacking, striking, hitting or violence of any sort on my person. Do I send out this vibe asking for it from the universe? Then yesterday ",1,7.841666667,0.011893939
relationships,7rorpp,"[5, 10]","until i met my new boyfriend, he is amazing, he is kind, he is sweet, he is a good student, he likes the same things as me, my family likes him, and so on... but i dont feel that passion that rush i felt with my ex, the truth is that when i started going ",1,4.104027284,0.141670829
survivorsofabuse,9p2gbc,"[0, 5]","October is Domestic Violence Awareness Month and I am a domestic violence survivor who is still struggling, even after over four years. Lately I have been feeling very angry. Angry that my abusive ex received no real consequences for his actions. This man",1,7.910952381,-0.204166667
relationships,7tx7et,"(30, 35)","I think he doesn't want to put in the effort for the relationship to work (and we're both so difficult that we have to work on our relationships, doesn't matter with whom) but he can't be without me either. What should I do? I'm afraid this is gonna happe",1,4.338428899,-0.55
domesticviolence,7iphly,"[25, 30]","It was a big company so luckily I didn't have to see him all the time, but when I did, he again acted as though I didn't exist. I tried to talk to him and update him on the pregnancy, and ask him to be involved for our child's sake, and he literally stare",0,8.394243902,0.277380952
anxiety,5m3k80,"(5, 10)",  It cleared up and I was okay but. On Monday I was thinking about humans and how the brain works and it tripped me out I got worried that because I was thinking about how the brain works that I would lose sleep and I did. That night was bad just like las,1,1.028653603,-0.07962963
relationships,7nhy1v,"(50, 55)","I actually give an assistant half my emergency fee to come help me sometimes. I feel unsafe driving to ""house calls"" in the middle of the night by myself. I frequently bring my husband along as a makeshift ‚Äútech‚Äù or when I feel unsafe, which is obviou",1,5.991049383,-0.272916667
assistance,61eiq6,"[15, 20]","I just feel like the street life has fucked my head up. There's so much I don't even know how to talk about anymore, I just hold that shit. Only person I can really chat with is a pal I know at the bar. He has PTSD and shit from the military bad, hard up ",1,2.851934901,-0.117261905
anxiety,8sxdmy,"[0, 5]","Next week I‚Äôll be flying for our family vacation. The flights won‚Äôt be very long (just MSY to LAS then LAX to MSY on the way home), but flying really triggers my anxiety. Mostly I just like having control over myself and my surroundings, so the idea o",1,8.446392157,0.008571429
anxiety,87l3pf,"[20, 25]",Everything sets me off and I'm almost having a panic attack. I'm going to my dads soon and that also makes me anxious because I'm afraid that I'm not in the mental state to go there and I want to stay at my moms but he really isn't happy when I do that. A,1,4.208161312,0.016849817
anxiety,910inu,"(0, 5)","I‚Äôve been taking 12.5 mgs zoloft for about 6 months (yeah, super small dose .. but it was taking the edge off, i think). I decided to stop taking it for a few days to see if it was really helping. Now, about 40 hours since my last dose, I‚Äôm suddenly k",1,5.874752688,0.055
homeless,8l9pp2,"(1, 6)","No place in my city has shelter space for us, and I won't put my baby on the literal street. (I've been there before. Fine for new, but I don't want to have to go through that with a baby). What cities have good shelter programs for homeless mothers and c",1,4.976139535,0.393290043
anxiety,9wypos,"(4, 9)",These past couple of months have been the worst. My anxiety has gotten so bad it‚Äôs effecting my sleep and relationship. I‚Äôve become so paranoid about my health as well. I don‚Äôt feel like me anymore and I just feel scared all the time now over every ,1,3.090092166,-0.534375
relationships,7p6dgo,"(20, 25)","I asked him three time what happened. And after the third time I cried and went home. Month later he still don't talk to me and he and my mother started fighting for the first time in the relationship. Me and my mother honestly don't know what to do, he j",1,4.411948718,0.2125
anxiety,8mqmx3,"[35, 40]","The sensation lasted hours. It seemed like a circulation problem, and I panicked and of course ended up in the ER again. This time a doctor came to see me immediately. He wanted to talk about my anxiety. He said he could run some more tests, but he didn't",1,4.136814815,0.5
domesticviolence,815k8h,"[2, 7]",It did hurt but didn‚Äôt leave any marks. When I lied down I kept coughing and today it feels kinda constricted like there‚Äôs a lump in my throat. I‚Äôve googled and realised how serious it can be and now I‚Äôm terrified but scared to go doctor. What do ,1,4.154358974,-0.12962963
assistance,7rfjom,"(10, 15)","This is helping to get kids in the area tan ability to practice and a strong group of girls to look up to. So if you would please help busboy donating, even a dollar, would be amazing for not only us but the future generations of kids. Thank you so much f",0,5.963529412,0.192592593
relationships,7pg3a7,"[150, 155]","We had plans to move in together, a fancy $1,800/month home that she would contribute $400 or so. We spoke of children, marriage, all sorts of stuff. It's not that I thought she owed me anything for me doing these things. It's just that I felt like I did ",0,8.633939394,0.152777778
domesticviolence,79tofd,"[5, 10]","he still holds me back in life. he still finds ways to get to me. YET I STILL TALK TO HIM. and i always feel worse after i do. i've tried blocking him on social media, but he still finds ways to get to me.",1,1.080608696,-0.122222222
survivorsofabuse,9xkqh0,"(10, 15)","I was going through a hard time after our breakup (started seeing a therapist and psychiatrist). In the span of the 2.5 years since our breakup I have had other boyfriends and hookups. Some of my hookups happened to be some of his old friends, the most re",0,6.466606742,-0.012797619
ptsd,9jhgob,"[0, 5]","Through work I have been in some dodgy situations abroad. A number of times my life has been at risk, and I've had to defend myself a few times. I'm a civilian and have only had basic weapon training. &#x200B; We've always had an ex-military security cont",1,5.233096774,-0.066666667
ptsd,91oz3r,"[0, 5]","With a switch blade and open arms In a sweater vest that covers a ragged undershirt stained with my innocence Through faces that are never the same as the ones I dread finding in the crowd In the night, I rediscover my love of mares and how hoarse I can b",0,3.458461538,0.166666667
survivorsofabuse,9od6d6,"[55, 60]","According to [a study from <url> and its subjects, major risk factors were family problems and a child‚Äôs lack of confidence. These factors aren‚Äôt necessarily easy to influence but well worth looking into. As is another avenue that we should focus on m",0,9.173677419,0.203050595
ptsd,5pw5m6,"(45, 50)","If anything goes wrong, sexually, I want to cease to exist, and a lot of the time, I'm not able to do it out of sheer anxiety. I used to be a very soft person, and I hope I'm still kind, but now I'm quicker to anger, and I don't want to become an abuser. ",1,5.052341463,0.0225
anxiety,9erk04,"(17, 22)","I really don‚Äôt know what to do about this, and I‚Äôm wondering if I‚Äôm even able to get over this fear. A traumatic experience compounded it in me as a kid, and I‚Äôve been experiencing it for so long that it feels like second nature. It‚Äôs lkkely so ",1,5.649567568,0.291666667
assistance,9xjpy0,"(0, 5)",November has been one of the worst months in a long time. My mom was in a car accident and has no idea how she's getting to work. A few days later my grandmother died and I didn't even have enough money to attend the funeral. I drove home to be with my fa,1,4.667948052,-0.218367347
relationships,7q7vhn,"[0, 5]","Okay, So in since October have just got out of an eight year relationship . We were engaged to get married next year, but it did not work out. It ended mutually and we have moved on. In life these things happen. Since Halloween I have been seeing this Gir",0,3.403428571,0.25
anxiety,913uhm,"[9, 14]",Also the headaches. LOADS of headaches all the time. I‚Äôm so done. I hate this almost as bad as my brain constantly telling me I‚Äôm a POS. Anxiety is fun :),1,0.205357143,-0.14
ptsd,66cyu7,"(26, 31)","I'm just blown away by this doctor's willingness to help. I feel so validated every time I leave his office, like someone actually understands what I'm struggling with, and I don't have to convince them of my mental illness. Bottom line? Research docs if ",0,6.255544304,-0.0625
stress,8n761h,"(10, 15)",I feel like I'm trying to reason my situation though. I'm listing off things that a person would associate success with but I'm not seeing the things I'm failing at. Or maybe I do and the Navy is just exaggerating the things they want out of me? I feel li,0,3.842054598,0.155208333
domesticviolence,6qbkzt,"[7, 12]",I am really feeling like there are no good men. They are all just horrible to women. I think I would rather be alone than deal with any man again. Has anyone else felt like this? Did your feelings ever change?,1,1.998243902,-0.383333333
assistance,7q3gp9,"[15, 20]","You can see the detail on my [update 2 right <url> and here's a link to the [project github <url> So I'm begging you here, literally begging you. If there's anyone out there who would be kind enough to give me a second chance to fix my fuck up and finish ",1,3.09107767,0.049642857
homeless,75mb0z,"[15, 20]","Did I mention my parents are religious? I don't know if this is normal for religious people to treat. Whenever I tell them I'm terrified of being homeless they tell me I'm a ""acting like a baby"" and ""get over it"" my parents parents did not treat them this",1,2.828532853,-0.097222222
anxiety,9bk0uc,"(5, 10)",You are being invited to participate in a research study for Heather Cornett‚Äôs dissertation at Texas Woman‚Äôs University. The purpose of the current study is to examine the role of self-advocacy in those with a severe and persistent mental illness (SPM,0,12.28257143,-0.1
survivorsofabuse,6gtoia,"[15, 20]","This was a ‚Äúnice thought‚Äù, and even though I had been told my mother to never leave a drink at the bar, it didn‚Äôt cross my mind that there might be something put in this drink or that I was being pushed to be more intoxicated. After I started sippin",0,6.391014177,0.125
relationships,7sg6pl,"[5, 10]","But it's been 2 monthsalready this time. We didn't speak for Christmas or new year. I'm lonely, sad, angry at the situation (not angry at him!) and the worst part is not being able to talk or even know what's going on. We didn't fight before this so he's ",1,2.645,-0.112642045
domesticviolence,8pww89,"[10, 15]","Sorry this going to be super long, I have a lot to say... Tl;dr... see title. It was constant up and down; one minute we were happy and he was being more affectionate than he has in years, the next he's screaming at me and calling me a whore. I get it, I ",1,3.789473684,-0.008024691
ptsd,8b0cas,"[10, 15]","She was seventeen and they met in a hospital, he was in the drug rehab, she was in the mental hospital. She was 17, and he technically kidnapped her, running across the country. She immediately got pregnant with me, and he married her, at which point the ",0,6.962636364,-0.066111111
anxiety,90u0br,"[20, 25]","And it makes me more anxious which causes me to slip up *more*. It's getting WORSE though. I thought I could hold it down, this has been an ongoing issue for about a year or so and it has never been this bad but lately it's getting to the point where I ca",1,4.011269841,-0.078660131
anxiety,8jeclm,"(5, 10)","but I'm really, really afraid of public embarrassments and awkward situations. So I was in the train station and saw this homeless lady asking for food and money. I always help homeless people if I have change in my wallet. I walked up to her, took out my",0,6.106739726,-0.016666667
assistance,70i0ay,"[0, 5]","Our dog Jett has been diagnosed with diabetes and is now in the hospital to stabilize his blood sugar. Luckily, he seems to be doing well and he will be home with us soon. Unfortunately, his bill is large enough that we just can't cover it on our own (esp",1,7.346315789,0.04973545
anxiety,7e5yas,"[13, 18]",- Specificphobia: most commom type. It's when something causes exarcebate fear in the person. DSM-5 moved two more disorders to a specific group. But it is anxiety disorders: - TOC and post-traumatic stress.,0,5.863863636,0.333333333
anxiety,86dv8c,"[0, 5]","I didn't do anything during spring break, except maybe go to work. And even then, I missed a day because I just couldn't deal with the stress. Most adults get excited to tell you they did absolutely nothing during their break. And there was a time when I ",1,4.361454545,0.235
ptsd,65zqy9,"(0, 5)","I run <url>, which seeks to tell the honest stories of people across the country in order to foster a greater understanding of one another and increase empathy. In anticipation of May being Mental Health Awareness Month, we're hoping to write about people",0,8.109433962,0.25
domesticviolence,8hawwj,"(15, 20)","I feel like I will never trust my own judgement again. 3) I fucking HATE being this person. I hate being a victim. I would never judge anyone else in my situation, but I can‚Äôt stand having to see myself as someone who was abused. My grandfather abused m",1,4.15863354,-0.175
assistance,601uye,"(0, 5)","Dental Lifeline Network's Donated Dental Services (DDS) program ""provides free, comprehensive dental treatment to our country‚Äôs most vulnerable people with disabilities or who are elderly or medically fragile. These are people who cannot afford necessar",0,7.80627451,0.154166667
homeless,92wagq,"[10, 15]",I'm pretty healthy and have a silcock key for water but surviving the heat goes beyond just staying hydrated. Not enough food or the salt that comes with it led to bad cramps most mornings. Sleep was but a wishful dream. When the night time lows are still,0,4.116941176,0.05625
domesticviolence,88ddzu,"(0, 5)","I just got out of a four year, mostly on but sometimes off relationship. The last interaction we had, he was moving out. The night before, he had strangled me. We've had a toxic relationship, but mostly loving. He truly tried to love me as much as possibl",0,5.417403509,0.183333333
relationships,7q97j5,"[0, 5]","Hey everyone. I need a place to vent and place my feelings because I don't know what to do anymore. This evening while playing a boardgame with my BF and some friends, I found out my BF lied big time. Short: last year we decided that I would join him this",1,5.309913043,0.08
ptsd,8k9y39,"(7, 12)",I‚Äôve been leaving lights on at night both in the main rooms and my bedroom. The fear is both physical and emotional. I‚Äôm so jumpy at work and at home. I feel like I‚Äôm seeing things everywhere and little waves of panic wash through me all day. I‚Äôm ,1,4.984588235,-0.005017007
ptsd,7hzoqz,"[65, 70]","All of these things I think contributed to this being a less traumatic experience than the first birth. Just before the second birth, she kind of lunged towards our first kid in the road, which, we later learned, gave her symphysis pubis dysfunction <url>",0,7.994883094,0.152777778
domesticviolence,6nnm6e,"[15, 20]","Babies don't care about work hours you know. Husband finally says he'll watch our darling for the few hours between his full night's sleep and work. So we're doing this. I'm chipping on an embroidery project doing 'me' time, he's on bed with baby keeping ",0,4.811058824,0.0625
domesticviolence,8ulo7r,"[10, 15]","Why would you say that to me"" and gets extremely offended. He continues on by giving me the silent treatment for 50 minutes and then comes in the room and tells me ""You don't understand me. No one understands me. I give up. On everything.""",1,3.047826087,-0.0625
relationships,7qyzjs,"[5, 10]","She was already against smoking weed after college at first but now she seems to have moved to a stance where she's okay with me smoking weed as long as she's there when it happens, as in I could smoke with just her or when we're both hanging out with the",1,6.262163265,0.24
ptsd,7hzoqz,"[5, 10]","During the pregnancy and after the (traumatic) birth of our first child in 2013, symptoms started to intensify, including lots of depression, some manic behavior, and periodic angry outbursts. Somewhere in there we settled on a very (relatively speaking) ",0,12.98009836,0.126406926
anxiety,8jjz6d,"(15, 20)","I'm worried I have a blood clot or something that gets aggravated when I wear them. I just want to be okay and to have a good time on this trip, but I've been so out of it, and I'm at my wit's end. Right now I'm lying down and I feel blood rushing all thr",1,2.173351064,0.241031746
ptsd,9jkhvr,"[0, 5]","I have PTSD from my sexual abuse, and this week has been really hard. Really, since Dr. Ford came out against kavanaugh and the fallout of it. Today, though, was really hard. I come home to see my father watching fox news and agreeing that Dr. Ford is a l",1,3.683622642,0.029166667
ptsd,6veozn,"[25, 30]",And I don't ask for the nightmares to drain me of all energy and make me feel worse throughout the day the harder I try to be normal. I was planning on seeking counselling without my parent's knowledge for this condition once I get to university and get s,1,7.695806452,-0.084375
survivorsofabuse,99qzq1,"[30, 35]","i knew gay was humiliation. i tried bringing up to my dad, and he said he wouldn't care if his son was a fudge packer, nor would he care bout that son anymore. i then had to speak to the bishop of my church and tell him about me possibly being gay. my dad",1,5.338823529,0.208333333
ptsd,8h1rtk,"[10, 15]","I kept my head up and demanded the respect I deserve. I was very polite and expect the same. She wasn‚Äôt, so I put her in her place (she reprimanded me for leaving my gowns hung up in the dressing room). I came back to try on another gown and she goes yo",0,2.326277666,4.63E-18
anxiety,6nwu7w,"(10, 15)","I know every time I have panic attacks to remind myself it's just in my head, but it sucks when little things just make you feel like shit! Does anyone else get triggered by stupid things like this? ? I'm even just pissed at myself for now feeling mad at ",1,3.956555556,-0.300892857
anxiety,5x3dvl,"[49, 54]","> > In recent years, I've noticed that I deal with some post-nasal drip, sneeze a lot throughout the day, deal with headaches, and have itchy, watery eyes. Maybe I have developed some kind of allergy that is influencing this? > > Any help is appreciated.",0,3.0175,0.225
anxiety,97n1w7,"(5, 10)","In class, im always on edge, i cant focus on one thing for too long and i constantly scan my environment and I think they think im looking at them which im not. this also made it more awkward to talk to them. I been there for a month but im still very ner",1,7.56035964,0.015
ptsd,9p4ung,"[26, 31]","I'm gonna try and get some sleep as it's the middle of the night here, and I hope I get through tomorrow with a single trigger, like I always wish for before I go to sleep. I hold that hope, and I know one day, it'll happen. Not now, but one day. Edit: Th",0,4.551111111,0.045714286
relationships,7thdhf,"[0, 5]","I have a twin sister, Audrey, and I hate her. I genuinely can't explain it. I know it's so irrational, but it's just how it is, and I hate that this is how it is. We both came home for our mom's birthday, and I couldn't even spend 20 minutes with her. We'",0,3.710516129,-0.3
assistance,7h0dfh,"[35, 40]","I know this may seem like a small thing, but to someone with these problems, it's a huge deal and to be at a store where you do not feel ""safe"" around your managers and you can't talk with them and grow as an employee, what's the point of continuing to wo",1,5.922678571,-0.068055556
anxiety,7seukl,"(9, 14)","I was consuming quite a lot of caffeine (up to 500mg per day) during the summer and I'm medicated with 18mg methylphenidate for ADHD. (I was rarely taking caffeine with methylphenidate together as there are a lot of side effects after doing that, one of t",1,6.968333333,0.112
survivorsofabuse,8fseme,"[73, 78]","But she says she can't stand hearing it because she's got enough on her plate as she actually suffers with depression herself. I do read other people's posts and think maybe I've actually had it easy. Maybe I'm just over exaggerating thing, but i feel lik",1,5.183304348,-0.080208333
stress,91xcr4,"[0, 5]","I'm 24 and have massive amounts of stress going on with job hunting. I live with parents who are constantly on my back and getting angry with me for not having a job. They keep trying to help me by saying ""oh this place is hiring and that place is hiring ",1,3.83224924,-0.063079777
ptsd,7cm97l,"(0, 5)","When I was a kid, I suffered a kind of unlikely injury that basically ruined me mentally, and it seems like I just CAN NOT get away from it, because it's such cheap gory shock value that everyone uses it when they need cheap gory shock value. And if I'm n",1,7.293181818,-0.127777778
ptsd,9u84s0,"[42, 47]",I don‚Äôt know. Was this okay? Should I hate him? Or was it just something new? I really don‚Äôt know what to make of the situation.,1,0.558571429,0.009090909
relationships,7nv733,"(24, 29)",Any tips for making more friends? Tl;dr: I've had very few friends throughout my life. Recently I've tried reaching out to a lot of people but almost all of them will decline my offer to hang out at some point. I guess maybe this has to do with how I am s,1,2.928496241,-0.057380952
ptsd,5m5ue0,"(25, 30)",i remember her getting drunk and and ranting about a fuck buddy she was angry at. she came up with the brilliant idea of throwing a brick with a pie recipe tied to it through his window (i dont know). she told me to drive her to his house so she could do ,0,3.036825397,-0.081770833
relationships,7o1ti5,"(40, 45)","I think now she feels some of responsibility to help those in need and she gets a lot of gratification from these people who are very thankful to her. On occasion when we go out, we have been approached by these people and I can tell they are very gratefu",0,6.133174603,0.11525
homeless,7y7zh9,"(15, 20)","I looked regular for once and it‚Äôs been a while to feel that way. I wanted to show who I was today to the world, it was empowering seeing that face I used to be especially when I saw him just a month ago. I left right away to catch any train heading to ",0,5.283518908,0.010449735
anxiety,95ni2z,"(0, 5)","Hello guys. This is my first post here. Ever since I can't fall asleep on a random night (few months ago) , I started getting anxiety at night and before heading to bed but everyday is different. Usually, when I get on bed n off the lights, my body starte",1,5.649567568,-0.16375
assistance,8wewv1,"(0, 5)",I'm completely devastated. My cat was just hit and killed by a car. I don't think I'm allowed to bury him in the garden (we rent) and I don't know what to do. I've searched online and found loads of pet cremation services but they all cost a fortune. I do,1,3.206791045,-0.05
ptsd,8myeyu,"(0, 5)","Any help on how to stop ruminating? I work with some pretty toxic people and I can accept when people are ignorant and generally rude about my PTSD. I get it, some people are just really stupid and ignorant and won't understand how the assault affected me",1,8.474444444,-0.2125
survivorsofabuse,8g4sf7,"(40, 45)","Through everything, I just froze and waited for it all to be over. Each time I petitioned her to stop, she would become very visible distressed. She spent a lot of time talking about suicide. During the school year, we exchanged letters every day at schoo",1,5.781304348,0.328571429
assistance,8eqtqi,"(5, 10)",Is there anyway I could persuade you to go a view you love (if not any place is fine) and write something similar on a card  or piece of paper [I attached an example here]. Thank you all if you consider helping! It means the world. I'll probably post agai,0,3.927058824,0.154166667
relationships,7sjxl5,"[5, 10]","After college for about 2 years, I focused on my career and wasn't totally putting myself out there. Now, for the last year, I've actively put myself in the dating pool. It never seemed appealing to hang around in clubs or bars to hopefully pick someone u",0,6.192244898,0.068518519
relationships,7nnu34,"[30, 35]","I got 6 stitches. My parents love my bf and in fact, my mom and him are so close that they go on walks and go to the movies together. I felt uncomfortable and unwanted by his family. To be fair, I was also a little closed off with them but mainly because ",1,5.709052632,0.159895833
