subreddit,post_id,sentence_range,text,label,syntax_fk_grade,Stress Level
homeless,9f0s7d,"[5, 10]","He said he'd be back in the couple hours, never returned. I went down to the bridge spot around 10pm (~3 hours after he expected to return), recognized his bicycle, and left a note with a glowstick taped to it with my address in case he just forgot where ",0,6.987113821,0.063888889
relationships,7pypqs,"[25, 30]","Anyway our talk basically went nowhere and she said she absolutely will not stop hanging out with the group. I didn‚Äôt tell her to, but I did tell her that it hurts me that she would engage with people who apparently have so many negative things to say a",1,3.621882883,0.06875
anxiety,7z45n5,"(5, 10)","For a bit of background, our relationship isn‚Äôt perfect. We‚Äôre different people. For example, I‚Äôm a very liberal individual, feminist at heart, not very sportsy. He however is more moderate, has much older parents and is more moderate in terms of ge",0,7.100689655,0.205128205
ptsd,7ya8gl,"[20, 25]",But this incident has been troubling me for a couple of days now. I guess I am just sick and tired of my trauma interfering with my relationships. I feel bad for my boyfriend- he shouldn't have to put up with this stuff. I know he loves me and he is terri,1,3.076639344,-0.702857143
ptsd,9tlmwl,"(70, 75)","He brought me to hang out with the two of them a few times. I'm not sure why he thinks I want to erode their relationship, this is another thing I'm still thinking about. My best guess is that my ""touchy"" ness comes off as flirting and he thinks I'm tryin",1,7.546623932,0.03
relationships,7ss4tc,"[5, 10]",No reply. I texted again a couple hours later and he again didn't reply. I saved myself the embarrassment and just didnt go out that night. I texted him the next day to ask what happened. Its been a week already since this happened and be hasn't once text,0,2.793056604,0
food_pantry,7sn1i9,"(30, 35)","For the dog, at least, I can get stuff for cheap dog food or something, but the cat we'd need cat food. All of this weighs on my mind. With my anxiety, I keep going over it in my head again and again. I know I need to see a therapist, but you guessed it, ",1,3.324666667,0.1
relationships,7nzsj1,"(60, 65)","And after every episode with them he treats me like shit for a couple hours at work I assume wondering if I know about his behaviour and if I‚Äôll say anything. I completely ignore it and refuse to let it invade our work environment. It‚Äôs my world, and ",0,3.363921569,0.281944444
anxiety,7kepbk,"[55, 60]","I can't tell if that's me being a toxic person or not, and I feel guilty for feeling relieved. We were such good friends once, but I have to admit we hadn't talked about art or writing (the things that made us friends) for years. My anxiety has muddied th",1,8.18353719,-0.211111111
anxiety,990bim,"(15, 20)",I didn‚Äôt sleep that night and eventually was fine. Since then my anxiety has gotten worse- scary movies linger in my thoughts a little longer. I‚Äôve had a few mini panic attacks. I can‚Äôt get intoxicated anymore Bc I don‚Äôt like my mind being In a di,1,2.822058824,-0.145138889
ptsd,5ppnso,"(9, 14)","Typically this involves simply leaving the building inside the dream. If I can find a door and get out, the dream goes away. Sometimes I wake up at this point, and sometimes I don't, but I always remember it the next morning. Has anyone else been able to ",0,4.0575,0.066666667
assistance,5zclnp,"(2, 7)","His medical equipment (wheelchair, Hoyer lift, bedside table, trapeze lift and air mattress) belong to us to donate as we wish. We're looking for a good charity that would be able to pick these items up (So, with a truck?) and re-use them for a patient in",0,4.499246377,0.292
domesticviolence,9hhkw7,"(35, 40)","A emotional turning point for me was at 16, my dog at the time, a Lovable and super friendly Labrador who was about 3 years, decided to wander out the gate and explore when he drove in after work one evening. It was a freezing cold night i remember. Ge ha",1,5.956810127,-0.149652778
domesticviolence,6qe8h6,"[62, 67]","He saved me from my family. I don't want to give up on him because he's never given up on me. TL;DR: Boyfriend often has tantrums where he throws objects around the room, but never physically hits me. Is this abuse? How do I get help?",1,2.28,0
relationships,7nxm4c,"(15, 20)","I am moving in with my BF and am fine with doing it 'early' because I love him and want to spend more time with him, I am moving back to my hometown where I have a large safety net, and we are choosing an apartment that he can afford on his own if he need",0,14.14697959,0.269588745
relationships,7nfjvg,"(60, 65)","I want to note that I told my husband that if he came to me and told me for his sanity he needed to leave, I'd do it even if it was dumb for us monetarily. Nothing is worth him being tortured and putting pressure on our marriage. I think the reason we get",1,7.242455446,0.154166667
domesticviolence,8ue9ut,"[35, 40]","I hide my own set of keys. She tries to take her keys away from me and I refuse, which turns into a full-blown fight. I have marks and bruises all over my arms and back, as well as deep scratches from her fingernails. At one point, she had me on the floor",1,6.654754098,0.113675214
survivorsofabuse,6rtiew,"(0, 5)","Bit of background... My abuser was my mother's father, let's call him J, because he doesn't deserve the title Grandpa. My mother's mother was H, because she didn't like us kids and doesn't deserve the title grandma. Between 1987 and 1989, I would stay at ",0,6.1375,0.5
survivorsofabuse,7xvc38,"(8, 13)","[Alice <url> was raising hell about it in Europe in the '70s... and here in the '80s. But in those days, the only gasoline being poured on the fire were drugs and alcohol. Things have changed. Now we have machine guns anyone can get in a day if they know ",0,6.1732493,0.057142857
homeless,9gpabs,"(11, 16)","The thought of leaving my folks behind would definitely not be good for me mentally. I've thought about basically living out of my car, gym memberships to shower daily and laundromats to wash my clothes. Perhaps put all my stuff in storage and just keep w",1,5.233096774,-0.051948052
anxiety,9uuvyf,"(3, 8)","Which forced me to acknowledge that I haven‚Äôt been performing to my own expectations. Enter the anxiety attack. Sobbing, shaking, fidgeting, and rambling. To top it all off, I threw away my xanex thinking that I didn‚Äôt need the safety net. I thought I",1,4.745925926,0.2
anxiety,9tock0,"[5, 10]","I live alone, make sure my dog gets the exercise he needs, I keep my apartment tidy, I do my laundry, I make sure I‚Äôm eating good, I work out, and I still hang with friends and such. Really, the only time I play video games is after work (which is norma",1,5.609201681,0.239393939
ptsd,9wy6mm,"(45, 50)","I was nice, and it got me no where, so I was rude, it got worse. I compliment my mom and my sister as much as I can, I tell my sister I‚Äôm proud of her, I tell both of them I love them, I take care of my mom the best I can, but I‚Äôm still their verbal p",1,3.140928962,0.225824176
ptsd,73ttl1,"(95, 100)","Please don't make me feel worse. I mean, hell, I'm ashamed I even need to ask my boyfriend. But at least we have things to talk about and he's just naturally good at keeping me calm without even realizing he's doing it. He actually *helps* by being there.",1,3.301825397,-0.058928571
relationships,7nn564,"[15, 20]","I apologised and thought that was the end of it. It‚Äôs gotten to the point that if I walk into a room, she‚Äôll leave straight away, and if she doesn‚Äôt leave, or if I start talking to her or someone else, she sighs a lot so I know my presence is not wa",0,4.724033613,0.15
almosthomeless,9mmin5,"(5, 10)","Living with her parents has since become untenable. Her parents have taken her car, which is not under her name, and are kicking her out of the house. She needs both a short-term plan to do minimal damage to her current career and academics, as well as a ",0,5.181904762,0.1
ptsd,9kokqv,"(5, 10)","1. My father would abuse me consistently both mentally and physically from i think 4 to 14, maybe earlier. I don't really remember what all brought this on, but often it was school related. I remember being in a car seat, my mother didn't know what to do ",1,6.374199134,-0.017708333
relationships,7p60tc,"[20, 25]",I'll have written a letter to give to her. The letter is to repeat what I wanted to say for later so that she can read in case she has any misunderstandings or if I don't communicate it well. I don't know how to word my reasons to break up though. Obvious,0,6.273904762,0.1
ptsd,9gzded,"[30, 35]","I tell her this, which falls on deaf ears. Next day, we go to work things out. And I freak out when staff at the library call cops over us ""being loud"", I freak out over some very minor warrants. Which leads to her disappearing untill today when we have a",1,3.317957746,-0.01625
almosthomeless,7qfl6c,"(1, 6)","A LARGE portion of each of my check goes to making payments to this card but with the interest charges each month I budgeted and itll take me decades to pay it off and cost me thousands. I was in a tough spot, jobless, homeless, and had to rely on the car",1,6.933923241,0.170138889
ptsd,5qmict,"(3, 8)","im so scared of everything around me, whenever I have a panic attack, I can't even call out for help, I just choke on my own breath and cry im just fearful of what's going to happen in the future. I'm already seeing a therapist but i've been relapsing so ",1,3.132526366,-0.164935065
anxiety,8smefp,"[0, 5]","Hey guys, I'm 31, moved to a new city with my wife for the first time back in October, and am experiencing on and off anxiety for more or less the first time in my life. A couple quick questions: 1. How do I know whether I should see a psychologist or a p",1,6.792727273,0.186147186
relationships,7smyrw,"(0, 5)",Alright Alright Alright. I've been dating a single mom with two kids from two different guys who help out. She was married to the first for several years and has a 2 year old with the other. I've never had any kids myself. She is highly involved daily wit,0,5.273846154,0.081536797
anxiety,5y65d1,"[0, 5]","Posted this initially in /r/depression, but it's probably better off here. I went on an awesome 1st date with really cute guy. It was fun. He was super, smart, attractive, CHIVALROUS even... We're going on a second date soon. The problem is I have no idea",0,3.861363636,0.405291005
relationships,7nfxzy,"(0, 5)",My boyfriend M(26) and I have been dating for a year and a half. We live together. We definitely have issues were working through right now but our relationship has been pretty good. Up until a month or so ago I was making all these future plans with him ,0,3.884230769,0.119426407
stress,9j25ap,"[0, 5]","My wife and I live in New Bern NC a town impacted heavily by hurricane Florence. We live in a 2 bedroom 1.5 bath home with our 2 dogs, a cat and a rabbit. We are in our late 50's and lived a quiet life prior to the storm. 2 weeks ago 11 of my wife's famil",0,5.538516854,-0.065656566
ptsd,8nn63n,"[5, 10]","Here's a homebaked metaphor. This is only a reflection of my personal views, and is not designed to reflect anybody else's experience. ----- Just as witches and wizards in the novels avoid mentioning Voldemort's name, those who have experienced a trauma t",0,9.108090909,0.12
ptsd,92gxk9,"(40, 45)","Use open-ended questions to avoid making the other person defensive. If you want to avoid argumentative responses, it is best to ask questions that invite them to speak honestly. *How:* This questioning style lets them know you want to be able to figure o",0,3.384655172,0.415
relationships,7tk7va,"(35, 40)","Normal start of our day. He asked ""was the card worth the wait?"" I answered ""Yes, I cried, at the park"" he jokingly said ""of course you did, tiny tears x"" and then he asked ""did you take photos of the chocolates?"" I said ""yes babe"" and sent him the photo ",0,3.196239316,0.097619048
relationships,7qx7gb,"[5, 10]","I had no problem with that, but was kind of surprised that this was the first time I was hearing his cousin's name that he missed so dearly he spent 600 dollars on a plane ticket to go visit. I did not think much of it, but noticed that over the course of",0,8.556,0.2125
ptsd,5r1o6i,"(5, 10)",At least 20 Ritalin 30mg maybe more (I've learned how to take many at once over the years of daily medication). I don't remember everything but i tried to lie to him and he had to drag me to the bathroom and tried to make me throw up. After a bit i realiz,1,3.170567376,0.014285714
assistance,9ezmsq,"(0, 5)","Hello lovely people! I'm looking for anyone who is interested in taking a 10 minute survey, with the chance to win a ¬£100 (or equivalent) Amazon voucher. You need to be over 18, speak English as a first language, and be able to listen to some audio files",0,6.923073171,0.375
relationships,7tji9z,"[40, 45]","Clearly he's hurting inside and I want to get him help, but he refuses to get help because he denies he has a problem, and blames it on everyone else. He then punches me as a result of this, pushing me almost off my chair. I get up and push him away from ",1,6.104210526,-0.091111111
relationships,7scuer,"[10, 15]","   When we had our first fight I did EVERYTHING I could to gain her back in my life. I quit smoking cigarettes because she went on a ""I hate all drugs and anything smokable"" rant. I tried to be more mindful and kind because she said I was the opposite. I ",0,3.063238095,0.213636364
assistance,6dkdws,"[12, 17]","I used to be kinda smart so I graduated high school with about a semester of college credits so i have that. I also used to be pretty tech savy and used to help my family with their computer/phone issues (nothing major though, virus removal, printer setup",0,5.947713415,0.133826531
ptsd,5ryolf,"(9, 14)",I'm soo lucky/blessed that I have parents with an open home to me so that I am able to do this but I can't keep going on like this. I feel afraid to work. I feel like less of a man because of this. I worry about my future and if I'll ever get stable groun,1,2.405144928,-0.127777778
assistance,6v0vbp,"[3, 8]","In order to be able to walk, I need donations. Anything helps and is very much appreciated. Thank you in advance! ! <url>",0,2.975,0.40625
domesticviolence,8llkv5,"(30, 35)","He came home from who knows where and he walks in. I asked him where he had been because i was starting to get worried. He was mad, i could see it in his eyes and hear it in his voice. Next thing i knew he was behind me with his arm around my neck squeezi",1,2.201111111,-0.25625
survivorsofabuse,5wwot0,"[26, 31]",I wonder about that night. Did you ever get past that night? Did you have other nights like that? Did anyone ever ask if you were okay? Do you forgive me?,1,0.911870968,0.041666667
homeless,984dn1,"[5, 10]",I thought they‚Äôd give me another date to come back or put me on probation but that did not happen. They told me I wouldn‚Äôt be allowed back to my house until my court date in a MONTH. And even that is certain. Well I found a friend that I can stay with,1,3.717083333,0.053571429
ptsd,9u1ycz,"(30, 35)","I don't have any point, I'm just overwhelmed and want to give up. No one's going to read this long of a post anyway. I don't want to tell my therapist, I don't want to go to therapy. It feels artificial and contrived and uneven. When I google all this shi",1,3.158076923,-0.31
anxiety,8c4soy,"[10, 15]","Today I made the choice to go sign up for a gym membership. The working out part isn‚Äôt hard. It‚Äôs the fact that it‚Äôs a new place, and fairly wide open. I struggle with open spaces. But I walked in and signed up!!",0,0.995652174,-0.051060606
assistance,6a595u,"[0, 5]",Hello r/assistance. My name is Cameron and recently I was denied my social security payments on the ground of my mental disability improving enough to be considered able to work. My doctor disagrees with their assessment and local social workers are helpi,0,11.07391489,0.04375
anxiety,5yep79,"(45, 50)","Your brain could throw intrusive thoughts at you regarding ANYTHING that is really important to you - i.e. things you wouldn't want to be ""wrong"" or ""under threat"". But, bear in mind, your brain is trying to help you, it wants to ""check"" that these things",0,6.729722222,0.18
relationships,7soxzo,"[0, 5]","My girlfriend and I met through a messaging app. We come from the same country and speak the same language, so there is a sense of familiarity and closeness right from the start. However, as we grow closer, I'm starting to feel like she does not value our",0,5.783452055,0.083673469
anxiety,8mbir9,"(3, 8)",Today was a horrible day from the get go and I had to call out because I cant function with other people (I work in retail) today so I claimed I had a fever. Of course it had to be memorial day weekend making it one of the worst times for this and they ev,1,2.408528785,-0.420833333
assistance,7ztiy0,"(0, 5)","EDIT: Complete. Congrats to <username>, I'll PM you about shipping. It was really hard to read all the replies, I wish I could help more people. My heard breaks for everyone that shared their story here. Having to ""select a winner"" felt like the most unet",0,4.046451613,0.136666667
ptsd,6v4el6,"(15, 20)","It's sick and twisted. I've been getting nauseas and I've been having more dissociative flashbacks. My nightmares are coming back, but they're mostly of his parents. I'm afraid to see them, although my dreams are usually them telling me they understand. T",1,4.048965517,-0.093973214
relationships,7or4nl,"(20, 25)",Some day it‚Äôs gonna piss them off and she‚Äôll get killed. She lets people go ahead of her in line if she has more items than them. She lets people out of junctions even if she‚Äôs running late to places. Ends up holding doors open for tons of people an,0,2.600180723,-0.122222222
ptsd,9w0qju,"[40, 45]",I will always make strides to be there for others. To life my life if not to spite the voice behind my anxiety and take care of myself. I hope others struggling in this thread know that what is going on in your life is temporary...it will pass. ‚ÄúHow do ,0,3.026916667,0.05
relationships,7towdv,"(9, 14)","We've talked about it before and she said that it's not like that and she cares about me alot and all that, but at the same time these type of things keep happening. I truly feel that she does care and doesn't mean to neglect me but its just frustrating. ",1,3.582275862,-0.3225
relationships,7oqey7,"[20, 25]","A few weeks later, i found out that he had had a long term girlfriend the entire time. I felt like such an idiot when I found out. He reached out to me last month and I told him I knew he had a girlfriend the whole time and that if I ever saw him again I ",1,4.623586207,-0.15
relationships,7tdi54,"(2, 7)","I've never been on this side of the road, being the one to let someone know I'm not interested. I wouldn't know how to go about letting her know without completely devastating her. I know there is a risk no matter what I say, but how should I go about it ",0,3.655046296,-0.191666667
homeless,87p6h8,"(22, 27)","But upon second look, it can become apparent. It is hard to convey people's attitudes in a reddit post, but you can tell from people's vibes if they're being nice (and yes, that happened a lot) vs. if they have ulterior motives. So, maybe not the best red",0,7.490347826,0.169791667
survivorsofabuse,9bfkbe,"(20, 25)","Trauma changed the trajectory of my life. But I don't know if I would feel this way about my options if I wasn't anxious and wounded. My ex and I broke up because he never liked to leave the house, even for daytime activities. I wonder sometimes how I am ",1,4.67026087,-0.183333333
relationships,7rvimh,"[5, 10]","If I ask her anything about her life or about my uncle who she lives with (66 stroke survivor), she answers vaguely ‚ÄúHe‚Äôs fine‚Äù or ‚Äúask him yourself‚Äù. The unappreciative part come from the fact that when she asks me to do something and I have to",1,2.876410256,-0.008333333
relationships,7pt64b,"[30, 35]",I want that. I want him as well as a SO but maybe I need more time. Its not fair to him. Maybe I'm more invested than even he is. I don't know,0,-0.840714286,0.216666667
survivorsofabuse,90svsp,"(20, 25)","But how do I keep going with this girl and eventually ask her to hang out again because no romantic relationship can really progress forward until we're physically intimate with each other, but we can't get there unless we hang out. And she doesn't even l",1,6.373643411,0.153571429
relationships,7r5k3s,"(15, 20)","At some point in the past year, we discussed living together. She seemed to be okay with it and never had any objections. Since both our rental agreements will soon expire (hers in May and mine in July), I started looking for a new place online. However, ",0,8.52760396,0.02775974
ptsd,9l7rup,"[25, 30]",it wasn't my fault it feels like my fault I feel like the reason That mother shouldn't have had to bury her boy I should have been a better friend,1,3.55625,0.5
almosthomeless,7jk9dr,"[5, 10]","Even when i offered to pay, she wouldn't take it. I worked an hour away from my house and she was the one who was driving. She got pulled over quite a few times for driving while suspended for the unpaid ticket. They got tired of it and impounded the car.",0,1.778157895,-0.133333333
relationships,7nyzod,"[15, 20]","Every day I hope she messages me, calls me, or post on my Facebook. Any advice would mean the world to me. Thank you.   ---   **tl;dr - can't get over my ex**: How to get over my ex!",1,-0.133976834,-0.390625
ptsd,6zt8ni,"(10, 15)","But then i couldn't think straight. now i get flashbacks in school. I used to enjoy quantitative courses but now i get tension headaches from the flashbacks, and feelings of horror and hyperarousal. I just feel so violated and disturbed that it was for fe",1,5.773487179,0.133333333
ptsd,9gz6kk,"[30, 35]",They would text and call constantly throughout the day begging me to forgive them for hurting me but that  they're in love and love can't be stopped. They got increasingly angry and started calling me selfish for trying to keep them apart. After I wrote a,1,7.095163105,-0.013636364
relationships,7rtgah,"[0, 5]",My girlfriend and I have been dating now for 3 months. We have a very happy relationship most of the time. I love her and she loves me and we spend almost all our time together. She can be insecure at times and has a couple mood swings where she can be ve,0,3.512222222,0.43125
relationships,7u4t68,"[10, 15]","This has *obviously* created some crushing tension in the apartment, with no one really having to go other than work during the day. (We've all recently moved to the area and don't really have family/mutual friends to stay with.) Flash forward to last nig",1,7.242807018,-0.048214286
ptsd,9y5pz9,"[0, 5]",Sometimes I'll stop and just stand somewhere or stare until I get snapped out of it. I don't know for how long but it can't be for more than 10 minutes. I just found out about catatonia and I show a few other symptoms. When I dissociate it's usually a lot,1,4.085833333,-0.053125
domesticviolence,9oa6wp,"[4, 9]","I have no worth or identity or breathe. He has blamed me for everything. I guess I am getting an abortion. I was upset his friend brought him somewhere that he ran into a girl he loves, and even though it was just a second it really hurt me. He hides me f",1,2.98556338,0.016666667
relationships,7nya6p,"[40, 45]","Email her? She lives in his hometown, so an in-person meeting is not possible, nor do I think it would be wise. Should I do it anonymously? Should I provide screen shots of our conversations right off the bat, or wait and see if she requests it? I feel li",0,3.815188406,0.295238095
relationships,7st4t3,"[10, 15]","I could write a long book about it. The issue: My current issue is a strange one and I'm curious to hear other people's thoughts about it. Whenever my inlaws visit and stay the night, they bring 1 set of clean clothes and wash the ones they are wearing EV",0,4.366153846,0.006944444
stress,72jogj,"[15, 20]",Rubbing with shoulders with people and socializing too frequently may also be source of stress as the soul and body needs to re-energize it frequently. This is similar to the phoenix rising from the ashes to become a stronger self- a dramatic example whic,0,7.75755102,0.234366391
domesticviolence,9pwyqz,"[10, 15]","I don‚Äôt live at home anymore, and I take care of myself. However, my father is the breadwinner and neither my brothers nor my mother think they can leave because they don‚Äôt think they‚Äôll be able to support themselves. My brothers are still in school",0,4.259428571,0.186545455
relationships,7ocyup,"(35, 40)","Friends privy to the situation believe that she is just constantly keeping me on the back burner because I'm the safe option, when she isn't with somebody, or when she doesn't have anybody else. She knows I love her still, she knows I'd do just about anyt",1,7.083990826,0.07
ptsd,9orda5,"(2, 7)","I only get it when I have a flashback or strong reaction to a trigger. I notice it sticks around even when I feel emotionally calm and can stick around for a long time after the trigger, like days or weeks. It‚Äôs a new symptom I think. Also been having l",1,5.99,0.058712121
ptsd,9h5uha,"(5, 10)","I go through periods where all night I have nightmares and I can‚Äôt slee because of them. These periods last for weeks or months on end and then stop briefly. Three years ago I used to be on a medicine that helped with the nightmares, I can‚Äôt remember ",1,4.075454545,-0.075
