subreddit,post_id,sentence_range,text,label,syntax_fk_grade,Stress Level
anxiety,6dq1ug,"[5, 10]","I know the best thing for me is to find a new job, but I've been applying for quite awhile now with no luck and I really don't want to move to another job that I don't enjoy and will make me feel the exact same way. I sort of think I have an idea of what ",1,7.915428571,0.062137862
assistance,9rdhyy,"[0, 5]","I need to borrow $60, I was in the hospital earlier this week and missed a shift so I'm going to be short my next check, and I'm already down to only $20. I can pay back $85 by december 14th &#x200B; I've paid back $100 in here before, and I've also poste",1,6.759860465,0.005555556
survivorsofabuse,7nxyfq,"[15, 20]",my mom hollered at me to come help with something in the kitchen. I went slowly feeling like I was missing out on the fun. i purpously wasn't being much help to my mom and being the little bitch that I was seeing that she had my brother on her hip as she ,0,4.495952381,0.068055556
ptsd,7uxeui,"[0, 5]","Recently had an ASD evaluation, and was diagnosed instead with PTSD, a personality disorder, major depression, etc. According to my mom, I didn't start talking until I started preschool at 4 years old, and still wouldn't talk at home... but teachers said ",0,9.209473684,-0.0234375
relationships,7oin1z,"[10, 15]","The problem occurs when he returns to visit me for 1-2 weeks. When he's back at his girlfriend's house, he doesn't really have much to do. So, he spends a lot of time gambling. That in itself is a gigantic problem since we have almost no money. He is gamb",1,2.899769585,0.133333333
ptsd,9dr5oz,"(10, 15)","My parents take me very seriously and do what they can to make sure I can avoid him. My original post made it sound like they are not supportive of me and my healing process, but they very much are. I never HAVE to see him, I make that choice willingly so",0,5.120172414,0.2634573
stress,8enwxn,"(0, 5)","Hey there, I'm currently an 18 year old (nearly 19) finishing up freshman year (a course in general sciences with modules in Physics, biology, math, geology) with my first university finals in about 8 days. 6 separate exams, from the 2nd of May until the ",0,9.614,0.17037037
assistance,6cbzft,"[0, 5]","I paid off some of my credit card debt a couple days ago, but my company also charged me on their automatic pay system. I barely had enough this paycheck to cover just the single payment; when this extra payment processes it's going to cost me an overdraf",1,7.543636364,0.109821429
ptsd,99vcw1,"[10, 15]","and it's not even those three word either. no. it spiraled. in a store. and went from ""i will always love you"" to ""i stopped loving you and everything is your fault.""",0,0.500454545,0.55
domesticviolence,8vomaw,"(30, 35)",I was completely on my own by 14. When she felt the cuts on my wrists in the dark on night she asked if I was cutting ? I said no and she never said anything again. I could go on and on. I think she truly believes that because I am an adult now that all t,1,2.108571429,0.11
anxiety,95ij0n,"(0, 5)","i probably havesevere gad. at least i think i do. i need to get help because im avoiding anything i can. school starts again in a few weeks, and im an upcoming sophmore. i want to stop skipping lunch because all of the people in there make me anxious and ",1,3.559047619,-0.25
ptsd,82caa6,"[15, 20]","I told her what if her other son doesn't want him to live with him? the reality is no matter how bad or how old he is, he is still her son and she cant shake off that biological attachment she has towards him and not worry about him. This is where the pro",0,4.206582633,-0.037727273
domesticviolence,7c4yyu,"(10, 15)","John often withholds her very necessary prescription drugs to get his way, which is super messed up. Recently she had a small financial windfall and he became super nice and after they spent it all he reverted. He's extremely manipulative and abusive. She",0,6.085957447,0.081448413
survivorsofabuse,7q3qab,"[35, 40]","Lily is a really nice person (atleast, I'll continue to believe she is), and I think she might be open to it. Apparently, Mina and Lily have known eachother since childhood. I still think there's a bond there. I want to look up a professional too, or some",0,6.660155844,0.191666667
ptsd,7eoztz,"(1, 6)",How did you come up with it? I've wanted to kill myself almost everyday for 17 years. I'm done talking to therapists and asking friends for help. Right now I see two options: commit suicide or develop an emergency self-care plan for when I'm feeling this ,1,5.803783784,0.083673469
ptsd,5p0gfr,"[55, 60]","I'm afraid that maybe they aren't true and I'm demonizing him in my memory because having a villain that did horrible things to me is just easier to digest than the complicated truth. The worst thing is, I can't bring myself to talk to anybody. I always f",1,4.745909091,-0.314166667
anxiety,7bmrke,"[10, 15]","She gives me something weaker that I know will NOT work. I've been on so many meds, I feel like I'm at the point where I know what will work and what won't and she might as well written me a script for a sugar pill. This is what she decides to do after I ",1,3.706449788,0.004166667
relationships,7rst4u,"(5, 10)",I realized he is not very nice or smart and totally unwilling to cooperate/compromise. I wanted to leave but he had spent all my money (promising to give it back haha) and I had nowhere to go. I had the baby (he went out to eat with his mother while I was,1,5.278683788,-0.06456044
relationships,7pt4d1,"(30, 35)","I tried to break up with him at the end of the semester the day he was supposed to leave but he intentionally missed his flight to stay talking to me and talk me into staying with him. I don't know what to do. Mostly, I am scared that I will deal some kin",1,6.759220183,0.314285714
domesticviolence,77lawd,"[70, 75]","No I‚Äôm not. What I am saying though is that man and woman were designed to have a mate. A mate who completes you and makes you happy. A mate you can love and be loved by. I never searched for a man to make me happy or be my knight in shining armour, but",0,2.856666667,0.7
ptsd,9jfvt6,"(0, 5)","Things are great in my life, work, personal relationships... and then I get a Friend Suggestion  on Facebook, to see if I'd like to add someone from my past. My worst/abusive ex-boyfriend from 10 years ago recently joined FB. I hadn't been able to block h",0,3.718181818,0.025
food_pantry,7t13ph,"(36, 41)","-I'm not doing this for people to MAKE money, but to help those struggling to feed themselves and/or family. My days of that are over. -if any supermarkets or stores offer similar promotions in other countries, let me know and I'll look into what can be d",0,4.800238095,-0.0625
relationships,7pmkf6,"[5, 10]","Since then I¬¥ve met some ""wrong ones""- I mean guys who lied to me, for example this guy who was trying to convince me that he loves me and wants only me and I found out that he¬¥s been dating a girl since 2014 and that they¬¥re expecting a baby. So yeah ",0,3.542901961,-0.0640625
ptsd,9tgpx3,"(5, 10)",I'm new to this so please forgive me. I'm not very good at expressing my emotions. I need advice/help. I was molested multiple times by my biological dad when I was 5 up until middle school (so like 10 yrs old). After many times in the past telling my mom,1,3.77326087,-0.130786713
ptsd,8vpmyv,"(5, 10)",He denied it and ever since then I think everyone is out to get me and that nothing ever happened and I'm just insane. I always doubt myself and it's hard to hang out with anyone because I think they all have some agenda toward me. I know logically nothin,1,4.983917221,-0.308333333
survivorsofabuse,75t6mo,"(30, 35)","He and I have been pretty ""huggy"" the last couple years, and since he scared me I cut all physical contact off completely. He didn't try to initiate it today even though we won't be seeing each other for several weeks, so that's something. I don't plan on",0,6.855952381,0.066666667
relationships,7sdyx6,"[120, 125]","So we were talking about it and she wouldn't budge again. The conversation started to heat up, nothing I said was enough, that we would buy something, that I would cook with her, that we could go 1 day earlier and cook at my grandma's, nothing. She pushed",0,5.48088785,-0.051851852
ptsd,7zf48g,"(25, 30)","He took his sleeping pills before cleaning out his gun. The magazine was out, but there was a bullet stuck in the chamber. He accidentally pulled the trigger. It went straight through his arm chair and hit his dog in the head. She yelped slightly and trie",0,3.554245614,-0.040740741
homeless,60upg8,"(0, 5)","I have been living in <location> at a homeless shelter run by the Salvation Army since the beginning of February (I know it hasn't been that long but still), and I started a new job a month or so later around the beginning of March. I don't know if my bos",1,14.44344828,-0.128826729
relationships,7tgmur,"[30, 35]","(If so, how do I work on fixing that?) * Is this a lack of clear communication? (By either one party or both) * Should I try to get back in touch with them? Thank you if you made it this far.",0,0.875,0.066666667
food_pantry,9qr1nd,"[19, 24]","<url> <url> I am willing to answer any questions and show proof. * Edit, the candies are because after 20++ years he finally stopped smoking and it helps the cravings. The apple juice helps him take his medication.",0,3.192073171,0.125
relationships,7r2t3d,"[25, 30]","It‚Äôs resulted in me coming up with excuses to not hang out with him, which, yes, I feel bad about. Through my interactions with him, I have gotten the hint that Jack is interested in me, in a more-than-friends kind of way. I don't want to assume this as",0,6.307662338,0.048636364
ptsd,9guyyo,"[15, 20]","She also told me that I was an idiot for wasting my life, or attempting to end it anyways. I came out of that appointment in tears. That was a horrible day and I still think about it. It made me feel like I had nothing to complain about. Its only taken me",1,4.95838806,-0.383333333
anxiety,9f7nrj,"(20, 25)","2. Socialize! we sure did not evolve as lone creatures, we always evolved as packs, it was always crucial to our survival, and thats why we get anxious without it, even if we dont know it, but that doesn't mean you need to 24/7 socialize, Remember - lonli",0,20.12076923,0.001136364
assistance,6kgu5v,"(9, 14)","Also, as of right now, the 2017 team is on their trek to Alaska. Because of this, I'm limited on what I can do to raise money, since the main focus is on them. In the meantime, all I can do is ask for donations. I was hoping Reddit could help me out with ",1,5.2525,0.116190476
relationships,7o4j82,"[55, 60]","Am I being way overdramatic? Hope I provided enough information. I truly tried not to sound angry or overly upset.   ---   **tl;dr**: My mother has hit me quite a few times, put my clothes in trash bags when I don't clean them on time, won't let me lock m",1,2.833888889,0.013333333
assistance,6q0zon,"(6, 11)","I‚Äôm high risk for PPD seeing as I have preexisting BPD and anxiety, and going back into working immediately after giving birth would most likely be very damaging. Not to mention I haven‚Äôt had the easiest pregnancy, having had multiple emergency room s",1,8.938060606,0.088148148
ptsd,7kz28a,"[15, 20]","I didn‚Äôt realize before my brother had kids just how high pitch they can get. I don‚Äôt have kids nor do I want them. I‚Äôm expected to be around them 24/7 and when they‚Äôre all losing their shit, all I want to do is crawl into a hole and hide away. I‚",1,5.38757764,-0.089
survivorsofabuse,6mp8r7,"[55, 60]","She used to make me lie in bed with her when my stepdad was gone for the night and she would rub my hair and my ears. When I was a teenager and in my early twenties, I got so angry when people would touch my head or ears. She would make me sit in the fron",0,4.672222222,0.2
homeless,7d4w6j,"(0, 3)",What do you think would happen if you invited an individual with mental health issues who had been homeless for many years to move directly from the street into housing? Loyd Pendleton shares how he went from skeptic to believer in the Housing First appro,0,13.03,0.180555556
ptsd,9xh5gt,"(25, 30)",I was very severally bullied by the kids there. My dad managed to prove he wasn't a part of the robbery. He got me out of the foster care and drove me up to my oldest brother's house (he lived directly across the water from Seattle). Told me he'd be back ,0,3.821538462,0.025
anxiety,78fynx,"[10, 15]",* Almost impossible to remember something happened in past on conversation. * Hard to remember names of people or what happened in film and names from there. * Can‚Äôt recall nothing from my childhood‚Ä¶ there is only some common memories. * I literally h,1,5.371541096,-0.304100529
survivorsofabuse,9md6qz,"[100, 105]","With my therapist's help, I was able to start functioning better, being able to take care of myself a bit better, do certain things for myself, like going into a store solo for errands, without needing someone there as a safety-anchor. &#x200B; However...",0,10.585,0.249553571
assistance,98f957,"[10, 15]","We‚Äôre still behind on bills, but we will catch up now we‚Äôre finally in cheaper accommodation. I‚Äôve tried everything I can to earn some form of income, but unfortunately I‚Äôve not been able to land a part time job, and I‚Äôve been deemed ineligible ",1,6.645658807,-0.00875
stress,655dz7,"[5, 10]","If you qualify, you will complete a variety of questionnaires online. The study will involve four online assessments over the next month that should take about 40-50min to complete and you will be compensated up to $70 in online gift cards to Amazon. A fe",0,8.092142857,-0.053571429
ptsd,7vjkpv,"(8, 13)",I am constantly freaking out and unable to see friends that don't know about my diagnosis or make the friends that do feel very uncomfortable. I feel guilty because I feel as if I brought this all on myself because if I hadn't of taunted my father he woul,1,5.504651163,-0.110714286
food_pantry,7adan0,"(5, 10)","So I'm getting a cheap apartment, most utilities included, and all maintenance covered. I used the last of my savings for the application fee and hold fee. I'm going to be moving at the end of the month and it's going to be tight, paying the security depo",0,7.1775,0.174489796
assistance,6nhkiw,"[15, 20]","After burning out, I fumbled through a tough, 8-year commitment in the United States Marine Corps. I then went back to college and  obtained an Associates Degree with a 4.0 GPA, before burning out just shy of a Bachelors. Following that, by leveraging my ",1,9.345425743,0.004265873
anxiety,9svqbq,"[0, 5]","Background: This time last year I lost my job, got evicted and my car broke down all in the same month. Cut to today and I found out my site is closing and we'll all soon be out of the job. I just feel like a big ball of anxiety and like I can't quite tur",1,1.471954023,-0.131111111
relationships,7s8oka,"[5, 10]","Good goals - She finished undergrad and already wants to go back to school. I value girls who want to get a good education or pursue entrepreneurship. Doesn't ask me for much - Given my financial situation, she hasn't asked me to do something that was out",0,4.186483516,0.275
anxiety,9i9y2v,"(0, 5)","I just got a small job offer from a friend of mine who works prepping dessert plates at a restaurant, and well I agreed to try it out but I feel so anxious. This happens every time I look for jobs and they actually want to hear of me. I don‚Äôt know why, ",1,4.104920635,-0.08030303
assistance,5syibd,"(0, 5)",Hello all I am about to be laid off. I am currently on a prepaid cell phone plan. I use this basic smartphone for all extra side money and internet. I can barely pay the bill this month but the device is not working well at all as it is old and I spilled ,1,5.452115385,0.121428571
ptsd,82ydgx,"(35, 40)","Since this happened during a pivotal time in his developing sexuality, his body reacted despite his revulsion. He has been prescribed a myriad of medications to try and combat the dreams but not much has helped. It will work for a week to a few weeks, but",0,8.818868687,0.04
ptsd,9d5yww,"(1, 6)","It's unfortunate we can't crosspost links from other subs like r/psychology to r/ptsd because sometimes a useful article comes along that might really help. TL;DR - This study suggests, for whatever reason, some people who experience trauma learn to assoc",0,6.4975,-0.06547619
relationships,7prwnl,"(10, 15)",I've been thinking about this for weeks and have talked about it with her on numeral occasions and I feel like I'm losing my mind. I just don't know what to feel right now and I'm an emotional wreck. Am I overthinking or it are these reasonable things to ,1,1.823393939,0.161904762
relationships,7tpokq,"(35, 40)","I will not be sharing my credit details. Though hard, I will end my friendship with her. Might think about it if she apologizes but am not sure at this moment. I will cherish connections with more on my other friends who were super nice to let me know wha",0,6.136728395,0.086666667
relationships,7thdhf,"(35, 40)","I called my boyfriend, and I just ranted at him. He was shocked. I've never spoken like that about anyone. I wasn't even thinking about what was coming out of my mouth, and I just called her all these names and said all these horrible things about her whe",1,2.913846154,-0.858333333
survivorsofabuse,9cafks,"(20, 25)",I'm so scared I actually don't want to lose him. I love him. I love him so much. tl;dr: I've gotten gaslighted in my past relationships and it's caused me to have a lot of self doubt about my thoughts and feelings and question myself constantly. in this c,1,4.500662526,0.135714286
ptsd,8vwmzd,"[5, 10]","We have an active community with diverse interests and diagnoses. We do require that our members be people suffering from disorders rather than asking for advice on another's behalf. Our focus is on support, so we have 10+ support channels in which you ca",0,8.531764706,-0.066666667
anxiety,6l3rru,"(10, 15)",I have it for 7.5mg twice a day. I also took Trazadone one night and felt similar effects from the Klonopin. Does Buspar have much in terms of withdrawal? I am thinking of maybe picking up some L-Ornithine HCL and Glycine for sleep quality to see if that ,0,5.547142857,0.01875
homeless,8i98ia,"(0, 5)","I might be homeless soon, I have about 500 dollars in my bank account and I NEED to get out of Massachusetts. I am going to be a college drop-out in my 3rd year due to family reason instead of academics. After a lot of research, I am contemplating between",1,7.857534884,0.01875
assistance,9ryv5e,"(0, 5)","I will, personally, be testifying as a witness in this case Justine's custody was taken away after a suicide attempt while battling postpartum depression. Her son and his father were home at the time of the incident. Following this Atticus was put solely ",0,9.318,0
ptsd,7v2hw8,"(25, 30)","But he doesn't ask, either. When I do open up, all I can think is ""He's probably bored and wishing I'll stop talking."" or ""He hasn't contributed to this conversation once, why don't I just talk to a wall?"" I know he cares, he really does. He has voiced hi",0,2.283365385,-0.1
relationships,7nt9r6,"[5, 10]","So the now: we had been commiserating for a while about our shitty exes and stress, and about 3 weeks ago I was on a date and realized I would have rather just spent the night with her instead of the date. A couple days later while having some drinks and ",0,6.654754098,0.03
ptsd,8b0cas,"[25, 30]","When I was eighteen I lived with my father as adult roomates, I found him four years later at 22, when he died of a heroin overdose. He was bereft at the fact that he had done wrong by us kids during those years. He had striven to be better than his fathe",0,5.844041237,-0.04510582
survivorsofabuse,7w6cgi,"(40, 45)","Then right after, said ‚Äúdo you think I made you feel like that ever?‚Äù Then got noticeably nervous. Which makes me think of one memory that sticks out as a child (I don‚Äôt have too many childhood memories, but I remember this one well). I was probably",0,3.65275076,0.121130952
relationships,7p9erc,"(10, 15)","And we end up spending an indefinitely long period of time together that just never seems like it will end. I would really like to be able to hang out with her, like cook dinner, or go to a bar, or watch a movie, for example, and then just both go back to",0,9.176444444,0.108333333
anxiety,880mfl,"[15, 20]","That was easy, I was probably anxious about my health because I lost a very close relative when I was 11. The second step was to identify when my health anxiety episodes were taken place. Checking my records of doctor visits, I could see that my health an",1,9.286,-0.003869048
domesticviolence,8snx1d,"[40, 45]","I endured months and months of all types of abuse, the final time was when he grabbed an iron gym equipment that you attach to the wall and threatened to hit my pregant stomach with it. After all of this, after denying my child, saying he wasnt the father",1,8.334691011,0.05
relationships,7r6fsr,"(15, 20)","I was home for winter break, and I didn't see him at all during that time. My issue revolves around me feeling insanely guilty anytime I'm out with him, anytime he buys me things, etc. It's like, I hear my mother's voice in my head and she's yelling at me",0,4.259428571,-0.45
almosthomeless,5ndpqi,"(5, 10)","I can't find an affordable place to rent that would fit in with my budget and I have no savings. I've looked up a lot of the shelters around me that give out meals/ have assistance, but they all close before I get out of work so I can't even drive over an",1,4.74010582,0.3
relationships,7tl21g,"[35, 40]","Be ready to contribute (reasonably). B - Calmly, with neutral to negative vocabulary and intonation express dissatisfaction with certain behavior, action or outcome of action and politely ask not to repeat same behavior/action/make sure particular outcome",0,11.33155556,0.148941799
anxiety,61z3an,"(0, 5)","I'm 29 and I've just committed to moving into a shared apartment in my city centre. I've never lived in a place like this before because it's an en-suite with my own double bedroom and bathroom, but the kitchen and lounge is shared with about 15 other 'pr",1,5.973299401,0.163278388
relationships,7tcbij,"(5, 10)","I grew up my country‚Äôs equivalent of the bible belt. My country is well known for being very very progressive in our larger cities, and very very conservative in our villages ‚Äì this is true I think for most countries, but the sheer difference between ",1,6.209627329,0.096785714
homeless,86p2q2,"[0, 5]",I wanna break down my situation. I know you guys can't help but I need to vent. My partner works in a job he is treated like crap in and hates for little money. He is looking for new work. That's good and I'm proud of him.,0,1.119714286,0.082218013
homeless,9b70w4,"(6, 11)","I've put him up in a motel for a few days, bought him a bike, and gave him some money, but I know I can't afford to have him stay at a motel forever (or even support him like that! ), the money will run out, and I just feel sick/stressed/sad because I don",1,5.402442396,0.147727273
domesticviolence,5uapbl,"(0, 5)","I'm having problems with a friend and I thought an outsider's perspective might be useful. She's always been a bit overly emotional and controlling, having previously been very easy to anger, and having previously tracked me and an ex through my phone, an",0,7.996302521,-0.088181818
homeless,6jbf58,"[0, 5]","Two days ago I packed all of my clothes into my car and have started living out of it. I sleep in the parking lot at work, work for 8 hours, and then spend the day at Starbucks on the internet and charging my electronics. Once Thursday rolls around I will",1,8.724360656,0.1625
relationships,7s0lyo,"[15, 20]",It honestly felt like someone punched a hole right through me. Later in the day I texted her and we talked. I asked her how the trip went. She sounded exited to talk to me and it sounded like it would work out between us. I asked her abut her friend and i,1,3.287666667,0.271428571
ptsd,8escde,"(6, 11)",It does eventually pass once i realise they are sticking by me. Some just cant stick it out which is fair enough. I find it frustrating though as i have just drove someone away who i really liked. He has ended up deleting and blocking me as he didnt at al,0,6.353662338,0.225
relationships,7tynea,"[5, 10]","It's heartbreaking to watch him get up at night to cry. I suggested therapy but he's not in favour of it. I think his father passing has also altered his reactions, which are out of whack now. I was sick last week and was not in town - he let a couple of ",0,3.864589041,-0.238095238
survivorsofabuse,9gpx9u,"[0, 5]","Basically I‚Äôm going through quite a bit right now. I suffer from anxiety, depression probably (low mood, irritation, poor concentration) and things just haven‚Äôt been going that well. My friend who has autism makes off-the-wall jokes about death and ki",1,4.656190476,0.155952381
relationships,7q4qv8,"[10, 15]","When I'm single it's never an issue if a person I'm seeing is sleeping with others but as soon as I fall in love, I can get kind of possessive. My partner is very much the opposite. All of his relationships have been open and he's slept with pretty much a",0,5.556237113,0.120612245
ptsd,8bvz51,"(5, 10)","I was diagnosed with PTSD after I was assaulted when I was 18, but to be honest I've never really felt like I had it. I can usually push things down so deeply that I don't feel many repercussions of what I've been through aside from a lot of shame. In the",1,4.221856867,-0.079017447
