subreddit,post_id,sentence_range,text,label,syntax_fk_grade,Stress Level
relationships,7qh3jm,"[45, 50]","If she were honest or apologetic, I could try to understand. But is that naive? I‚Äôm just confused. I‚Äôve tried to give it time, but I understand less and less. I signed up for Facebook over the weekend, and Corrine was in my suggested people to add.",0,3.403428571,-0.086666667
relationships,7q97j5,"(15, 20)",And I really don't know what to do. This isn't nearly the first time he lied and there have also been other things (like him being unemployed for 6 months and not looking for a job while his parents pay foe everything and he lives with me). But I get that,1,2.955993432,-0.06031746
assistance,80io65,"[5, 10]",We are begging you for **$200** to buy bus tickets for the **4** of us to travel via bus. It is a **14 hour** road travel from our current city. The $200 will cover our travel to there and going back here. &nbsp; This would really mean a lot for me and my,0,2.109318182,-0.078125
ptsd,95ozde,"[20, 25]","We spoke of Buddhism and karma and about how everything is connected. Turns out, everything is related. My grandmother was a bitch to my mother, my mother was a bitch to me, I had to act out in a way or another. The Perpetrator, the Victim, and the Rescue",0,7.066941176,-0.0375
relationships,7u5vle,"[5, 10]",I was venting how pissed off she made me to one of my friends. I didn't know [3M] was listening to our conversation. He asked me and my friend what a period was. My friend took him to his mother who was in the kitchen. She just told us to keep an eye on h,1,2.758903226,0
homeless,910q15,"(2, 7)","For example, I'm selling something that's worth ¬£50? You can have it for ¬£10. I hate it, I want to cry. I've had items listed for about 2 weeks, they're all responsibly priced or under and I'm having to accept low ball offers as I have no other choice. ",1,2.797743902,-0.022916667
relationships,7pxhr7,"(0, 5)","Sorry this is so long! Thanks in advance if you manage to read it :) My best friend Grace and I met when we were 10 and became best friends almost immediately. She was always the ""leader"" in our friendship ever since we were young. I didn't mind it, I act",0,3.2891258,0.27875
domesticviolence,6f5fy2,"(45, 50)","She has a temper and some anger issues. I'm the only one that has seen that side of her, maybe I'm just the cause. To add to the story, she left me with scars on my arms a few months ago while I was trying to calm her down while giving her kisses. She dug",0,4.311684211,-0.072222222
assistance,9kop6c,"[19, 24]",The link to my gofundme campaign is: <url> I included a video on my Gofundme which explains my whole situation. I thought that recording it will be better than writing it down. Thank you God bless,0,3.641315789,0.181481481
ptsd,87culh,"[5, 10]","Writing is one of my methods, and I wrote this and I would really appreciate feedback or any insight on why I am not being able to withhold myself today. ‚ÄúI‚Äôm writing this, because I am experiencing and attempting to avoid a full blown panic attack. I",0,5.282244898,0.130555556
domesticviolence,7jkjfi,"(0, 5)",I‚Äôm looking for advice to try to help a relative. She‚Äôs going through a very ugly divorce with her husband who‚Äôs trying to get sole custody of their three-year-old son. He‚Äôs dating a woman with a substance abuse problem and a criminal record. He m,0,6.635268293,-0.218333333
ptsd,9vpvk0,"(5, 10)","It's not really safe for me to be driving. I can't even function enough to do the grocery shopping. Sometimes it goes into an actual panic attack, but not too often. My husband has recently banned me from going anywhere alone unless absolutely necessary (",1,6.212,-0.05
ptsd,875jal,"[18, 23]","Is it different to other occasions such as people/objects that remind you of it (more/less extreme, etc. )? I hope my questions don't come across as confusing (like that last one!) This isn't a bland survey, so feel free to comment anything outside what I",0,7.6975,0.100694444
relationships,7nfm2h,"[10, 15]","It's been a while so I thought those feelings were long gone. At one point, I asked if Lily would come talk to me in my room, which she agreed to. In there, we made out. I don't remember a ton, but I do remember pulling away and immediately telling Lily """,0,1.522777778,-0.45
assistance,8vvat1,"(0, 5)","This is so hard to write about for me. Attempting to describe what I've been through cuts me really deep down and spins me through flashes of pain, tears, and the deepest depression. I really feel kicked when I'm already down. So please, forgive me for th",1,4.984588235,0.03287037
relationships,7nrptd,"(0, 5)","My girlfriend has been under major strain since last year when took a new job, she has been depressed and has mood swings for half a year now. She has always been inverted and melancholy, but I feel that the new pressure has pushed it to the verge of disa",0,7.01675,-0.016429924
ptsd,8uvje9,"[5, 10]",I was abusive and my mother was scared for her life. This started at a very young age. The first time I remember her telling everyone she was scared I would kill her I was about 7. I had only raised my voice in protest because I was being severely punishe,0,4.61576244,0.28
domesticviolence,8t24ey,"(5, 10)",Essentially they had a few speakers which ran from people in the organization to the mayor and state representatives. Then they had a short film about the director who was retiring and essentially how she transformed this small barely funded group into an,0,10.56937634,0.072727273
anxiety,5xkdx3,"(39, 44)","I feel alone, because I feel like people don't think ""I was having a panic attack"" as a legitimate excuse to miss something. I don't even feel like others with panic attacks 100% get it, because I don't really get that feeling of a heart attack or anythin",1,9.061747899,-0.03125
ptsd,79yxek,"[5, 10]","A sustained loud noise like music doesn't bother me. Basically, I just scare very easily and have a visible response. It's pretty embarrassing in social and professional settings to the point people think I'm faking but I really can't control my reaction.",0,7.877018634,0.21030303
anxiety,8mvemw,"[0, 5]","I'll start of by saying, sorry for my bad English or grammer. English is not my first language. I don't talk to anyone in class. I avoid people and girls who try and talk to me because I get soo nervous and my heart starts pounding. I don't talk to a sing",0,2.739920635,-0.170238095
ptsd,5n56lm,"[60, 65]","I am afraid of anything and everything at the same time I am afraid of what happened or what may happen. I am afraid the world, the earth, the skies, the stars, aliens, humans, animals, whatever fucking bullshit thought that had occurred in my head that m",1,8.387765957,-0.507142857
assistance,81hnhs,"[5, 10]","I have been able to catch up a little bit on my rent that was behind with my income tax return, but I am still striving to catch up completely while I try to find part time work that I can perform. I am unable to work gainfully and I was denied Social Sec",0,10.89840426,-0.026736111
survivorsofabuse,8hmyyb,"[5, 10]","Before it happened I had been good friends with him and I admired him a lot as a child. I don't want to ruin his life, and whenever I meet him I act normal and happy. When I talk about him I smile and act normal. Sometimes I feel like I can forgive him fo",1,2.724749035,0.25
food_pantry,8gcwjt,"(0, 5)","I just got a new job and I won't get paid until the 18th. I've only been unemployed for a week now, the company I worked for closed and after bills I have no money. I was already trying to get on my feet from being let go from my long-term job in October.",1,7.045076923,0.009090909
survivorsofabuse,69nrtt,"(60, 65)","They'd be punished for playing, for not using the bathroom when she wanted them to, for looking at her even. I'd get punished for playing with them too, or for letting them use the restroom when they asked. She would keep them in their crates for hours, s",0,4.328657534,-0.25
relationships,7oaraq,"(24, 29)",I also want to set the record straight with my family. What should I do? Tldr : I dislike my mom for legitimate reasons. She's telling my family it's because my head is all messed up from my mental illness. It's gotten back to me and is making me angry an,1,4.241875,-0.18
assistance,7a0vfs,"[5, 10]","Friends, pets, family if you have that kind of support, community resources, whatever it takes, don't be afraid to ask. Above all, don't quit. You deserve better, you deserve to survive, you deserve help and you deserve to be treated with dignity and resp",0,5.622058824,0.242857143
homeless,8wy3ga,"[15, 20]",‚ÄúHey you can‚Äôt lay down like that man.‚Äù I could tell you what I wanted to say to the oversized Krillin looking mother‚Ä¶ *inhale* but that was because I was tired. I sat down to kill time before the shelters in the morn began to open. I decided to m,0,3.241792169,-0.257539683
anxiety,6gsu7s,"[5, 10]",Today I logged on to my computer to have a few games with friends that I know. Before the games started I got into a discussion with a friend and a few points to take away from the conversation were: - People don't know how to react when I'm around becaus,0,4.971296296,-0.1
domesticviolence,9ba0cp,"(20, 25)","I legitimately do not know anyone who has survived this, and I feel like i'm not even human any more. As I type this, i'm sobbing, because it's all just so FUCKING truly disheartening. I used to be a person. I feel like a ghost now. Are there any steps I ",1,6.864359551,-0.06
survivorsofabuse,89ddy5,"(5, 10)","Later in life she would try for children with my great Grandad hoping for a Daughter and have four Sons and then finally a daughter that would later die. Now she's the only one of her 9 brothers and sisters still alive. As sad as all that is, honestly if ",0,8.261168142,0.2375
survivorsofabuse,8bwuex,"[20, 25]","I understood that I was robbed of my innocence. I just wanted to hug the 15 year old version of myself and tell her that it would be okay. I have never verbalized these feelings. For the first time, I talked myself through them. For the first time, I felt",0,3.949428571,0.3
anxiety,7ntqmy,"[4, 9]","I take solo back packing trips and my friends really see me as someone fearless and free-spirited. It makes opening up about my mental health issues kinda difficult because they can't ""see"" me acting this way. I have a lot of anxiety and depression issues",1,8.688808511,0.091919192
relationships,7rst4u,"(50, 55)",etc. - Bob's father is always begging to let my daughter sleep in his bed. He takes opioids to sleep and once nearly died because his stove spilled smoke into the room and he didn't wake up. Bob sees no problem with allowing this. - Bob has been visiting ,0,3.989172414,0.05
ptsd,5rbe8t,"[0, 5]","So, I survived years of physical and sexual abuse as a kid. I'm finally at the place in my counselling where my therapist and I both think I'm ready to work through it. I really like her and trust her, but the guided questions she asks remind me of how fe",1,6.940818966,-0.027083333
ptsd,79i7e7,"[10, 15]",Things got better in middle school (thankfully) but it‚Äôs sad how literally 5 years as a young child (when life was supposed to be good) were so rough and still affect my life to this day. My home life wasn‚Äôt super bad but school was a living hell. I w,1,8.060277228,-0.045098039
relationships,7oni04,"[5, 10]","She has a history of being extremely over the top, and in our most recent argument she verbally abused me just for because I was upset that she broke my trust by telling my personal details to someone I didn't know. She did apologize a good day later, but",1,9.595615454,0.04675
domesticviolence,7vy47j,"[20, 25]",? What if I am at a friends party and a man whispers in my ear that he likes to stare at me so he can touch himself later....but he is dating my friend and he knows I don‚Äôt want to upset her?? ? What if I am in the car with a man and some lady cuts him ,1,6.881382979,-0.0425
stress,7idgz1,"[10, 15]","It feels very weird to feel like you have nothing to cry about, then cry, and then go back to not being sad right after you cry....) I just don't get it....I thought stress was something that built up over time....like you hop from 5 -> 6 after a few mont",1,2.828333333,-0.130753968
relationships,7omn3j,"(15, 20)",It‚Äôs gotten to the point where I feel like Tom is completely controlling me in the effort to ‚Äúprotect‚Äù me. He won‚Äôt let me go anywhere without him and when he is forced to leave me he calls me every half hour and panics and comes home if I don‚Äôt,1,7.487524272,-0.073333333
ptsd,9vdbsg,"(15, 20)","And I‚Äôve come unglued over absolutely nothing in the past, but I will seize upon something in these moments, anything, and the vein of anxiety erupts like a volcano and I can‚Äôt breathe I‚Äôm shaking I‚Äôm numb. And he is there just reminding me, gentl",1,2.277641026,-0.059183673
ptsd,9kc290,"[15, 20]",I spent the next few years being extremely reckless and impulsive. My home life was never easy I had an odd relationship with most of my relatives except my mom who was probably the only reason why I am even stable to this day. My brother was always seen ,1,10.43613162,0.013888889
ptsd,8ybflp,"(5, 10)","Unfortunately, it also affects pretty much everything in my life, including working memory and everyday events. It didn't happen daily or even weekly, but I was always afraid that I might say or do something that can trigger it, so I always kept quiet and",1,11.0799375,0.036764706
assistance,6fp90l,"(0, 5)","No, that's not an exaggeration but I wish I was. While I was driving last Tuesday I got extremely lightheaded, sweaty, and then pulled over and vomited blood all over the interior of my car. After a few moments of wonder if 'this was it' and deciding 'it ",1,7.262880562,0.0025
ptsd,93nq6w,"[0, 5]","Well, not big but petty. Look, I live around the area of my assaulters. If I ever run into them, I wish I could yell out,‚Äù rapist! You know what you did!‚Äù I wish there would be witnesses and that they‚Äôd get to think about it. Gosh, I know.",0,0.411714286,0.106534091
anxiety,5ucbua,"(35, 40)","I've never even told anyone this because it makes me feel like a 32-year-old loser. But now I have no pride to lose by saying it, so there it is. **I don't want to die, but the thought of living in a place I hate and having no control of my future is a wo",1,1.050646766,-0.25
ptsd,60wetx,"(5, 10)","Things can happen during the course of life that are all quite normal, then something happens to change our perceptions and suddenly we can remember something that previously appeared innocuous to us, but with our new found perspective, we can feel guilty",0,9.736,-0.340025253
assistance,5uay1l,"(5, 10)","She is in need of some house repairs and a reliable car. Her fixed income and family support isn't enough to get everything done. The van she‚Äôs driving has some serious problems. The transmission is dying and there's no heater or defroster. The lights, ",1,5.212,-0.01452381
ptsd,5q9s5u,"[5, 10]","However, this was 5 months ago and I have heard nothing about the referral. Things are going downhill (not with my eating, which is good! ), but my PTSD symptoms are loud. I'm not sleeping, my self harm has escalated and I'm struggling to leave my house. ",1,6.220757576,0.4875
ptsd,8wltkk,"[7, 12]","yesterday, I almost had sex with someone. but when it was happening, I felt only halfway there. and now my memory of it is hazy, and when I try to think about it I don't see it from my perspective, I see it from like above me. like it wasn't *actually*hap",1,4.177922078,0.1
ptsd,87ep1s,"[0, 5]",I realize that why I‚Äôm ‚Äúok‚Äù is because I am now  past the acute phase of ptsd that I developed last year. The flashbacks are better- less often and less intense. I have learned to manage the panic attacks at work - I have a process to deal with thes,0,3.388478261,0.142424242
ptsd,5phkvj,"[3, 8]",Now my treatment has stopped this triggering from happening and sometimes think about moving back. If I do I will occasionally see places and buildings connected to bad memories. When visiting my town now I am OK seeing those places but I don't like it so,1,4.656190476,-0.007954545
relationships,7tdu4v,"(47, 52)","I want to sit down and have a talk with my GF, but I don't want to roll in unprepared. Should I even be attempting to have this talk? If so, are there any books or reading materials I can go over to help back my case up?   ---   **tl;dr**: Looking for way",0,2.154920635,-0.077777778
domesticviolence,8xqnpo,"(0, 5)","when you first come face-to-face with a sociopath, you will be completely oblivious to who they truly are. they will be whoever they think you want them to be. they are fake. maybe it took him a while to show you his TRUE colors, maybe it was pretty close",0,4.218606061,0.192857143
anxiety,8vpbqp,"(0, 5)",So my roommate recently moved out and our apartment is pretty empty and ever since she moved out i‚Äôve had the worst anxiety attacks and have been kinda depending on my boyfriend and spending time with him to distract me but he works night and that‚Äôs w,1,6.484117647,-0.178125
domesticviolence,98xtdr,"(10, 15)","Disability allowance doesn't seem like it would be enough to cover even just my rent, never mind food (for me and my pets) and lighting and heating. I can't take my cat and my dog into a shelter. I don't know what to do. I feel like I just have to come to",1,3.36882716,-0.287878788
domesticviolence,6wzxe0,"[40, 45]",But Someone asked me if I needed a shirt and gave me one. I asked to call my mom but she couldn't understand what I was saying so he told her. The ambulance showed up and I told the cops that my boyfriend beat me but I wasn't giving any more information. ,0,3.559047619,0.5
homeless,7o5n2d,"[35, 40]","*Road to homelessness. * I develop the idea that I was going to die young, at around 21 yrs old. I dont remember how I came to this idea but this was it. I was obsessed by this idea.",0,1.165512821,-0.1
food_pantry,9eich5,"(5, 10)","It was only thanks to a few friends (and a few wonderful strangers here on Reddit) that I was able to pay our electric bill, but doing so drained all of the money we had on hand, and once we used the food we had from the food bank (we can only go once a m",0,6.638931624,0.1875
anxiety,5y9whl,"[0, 5]","Hi Im a 19 year old kid dealing with Agoraphobia over the past year. Very boldly said, Agoraphobia is the fear of going to public places, sometimes to even leave the house. The past week, some very unpleasant things have happened in my household. I told m",1,5.3625,-0.115952381
domesticviolence,9150tc,"[5, 10]","Well, last time we fought, I did finally call. I was so fucking scared and while he hid in the basement with all the doors locked and light off, the cops took pictures of my hands and neck while I asked them over and over not to arrest him. They told me i",0,3.396935484,0.0375
homeless,97417m,"[1, 6]","A guy pulls up and said the cops are on the way. He gives me a ride and we just get out of the parking lot when cops are all over, bugging everyone...especially the homeless and kids skating and stuff. We saw a few people getting arrested, but just cops m",0,4.908439024,0.209090909
anxiety,7poh4w,"[5, 10]","There's nothing I can say or do that will alleviate her worries. In the past I've tried to solve things but that doesn't help. I've tried just listening and agreeing or offering comments like ""that does sound bad"" or ""I understand"" but those don't seem to",1,5.219454545,-0.3125
relationships,7qox50,"[10, 15]",But I'm not physically attracted to him. Normally personality does a lot for me. I've met guys who I didn't feel attracted to and then started to really like because of their personalities (and vice versa). I go through days where I skype this guy and lik,0,8.48554717,-0.01125
almosthomeless,8pdg8d,"(10, 15)","My sickness couldn't be diagnosed at the time w/o insurance. I was too ill to remain in NYC so had to move home. Fast forward to Jan 2014, living with my father in Ohio-I woke up paralyzed from the waist down on the left hand side of my body (lasted almos",0,5.6875,-0.072569444
anxiety,93uo17,"[0, 5]"," I just stop doing productive things, talking to people, remembering appointments,  etc. I am unemployed and almost broke but looking for work is causing me to feel like I can't swallow or get a full breath. I find that I have played video games all day, ",1,7.78,0.052777778
relationships,7nk62d,"[0, 5]","I really need help! My boyfriend and I started dating March of 2017, and we had been friends for a couple years before that. For the first 7 months of our relationship, we were inseparable. We sleep in the same bed almost every night, though we are not mo",0,5.678705882,0.177857143
relationships,7tr5qy,"(5, 10)","But I was feeling more and more lonely... like I couldn't trust or rely on her. It was tearing me to pieces and I was always anxious. Finally, after a breakdown I had on christmas over my fears and the lack of help from my partner in healing from this, sh",1,3.007539683,0.108333333
survivorsofabuse,62doqq,"(26, 31)","7. This study will include only participants who are 18 years and older. Please send us a private message if you are interested in participating. Once you contact us, we will send you a link to the screening questionnaire to see if you qualify and to tell",0,8.348526316,0.069444444
ptsd,7sjlux,"[10, 15]","The past few nights I have been drifting off to sleep and then I get the sensation that I'm falling and jerk awake. This happens for hours. I forget the scientific name for this, but it doesn't really matter. I've had it happen before to me, but never lik",1,3.702692308,-0.2125
anxiety,9lj4k3,"[0, 5]",Wtf. I did this to myself. I knew I needed to study and I just kept putting it off and putting it off. I knew I didn‚Äôt do well but I didn‚Äôt think I bombed it so fucking hard. I‚Äôm going to have to lie to everyone about it.,1,-0.175128205,-0.291666667
assistance,5zvzqg,"(30, 35)","For the remaining money, it is going toward the mother's back pay to the district and continue to supplement the personal care attendant, as a bonus to the compensation from the state agency. I'm out of other ideas on what more can we do to support this w",0,6.793131868,0.115
anxiety,5rztot,"[90, 95]",I drove the 10 minutes home with my fiance on the phone helping me count my breathing. I got home and collapsed. I couldn't breathe. My neck and chest hurt. I was hysterical.,1,1.638470588,-1
homeless,8rf6qi,"[3, 8]","Today we had a really bad fight and she‚Äôs at home while I‚Äôm outside... I don‚Äôt think I can go back anymore and I have nowhere to go, with the very little money I have on me and only the vaguest sense of what to do. I‚Äôm an 18 year old non binary an",1,4.873214286,-0.07339876
relationships,7r7f7b,"[10, 15]","Therefore, it should probably come as no surprise that I sprung the question of ""What exactly are we doing here?"". Well, that backfired, as he alluded to the fact he was too freshly out of a long term relationship and didn't want to commit yet (Jason had ",1,9.289230769,0.063161376
ptsd,994ilv,"[20, 25]","But I do not even think the therapist is supposed to actually care, she actually seems to, but I cannot understand it. I did not start therapy because I thought she would care, I started therapy because I jumped off a bridge 1 year ago and I have an 18 an",1,7.045656759,-0.023196248
survivorsofabuse,9md6qz,"[95, 100]","I've been seeing the same one since then, and she'd helped me process so much, help me recognize and start to move past a lot of things... I went from hating and fearing my father (since the incident with my sister, which had ended up triggering the memor",1,11.41280423,0.044230769
relationships,7nzd86,"[10, 15]","With all of this garbage happening to me, I find it hard to keep my chin up and to not be negative. By anticipating the worst and vocalizing it, I feel as though I have a better chance of avoiding the worst, because I'm still suffering (making myself unli",1,10.05334454,-0.246230159
ptsd,5z8ilq,"[10, 15]","It feels great, but I'm worried. I tried to kill myself one year and one month ago. I am prone to depression. I am worried about crashing too hard, and I have kids to care for. Has anyone else experienced anything like this?",1,2.592,0.436111111
domesticviolence,9yc75n,"[20, 25]","Eventually I reported the texts, as they kept coming, and I recieved verbal backlash from his friends for doing it (I live in a small community, running into him or his buddies all the time).  Then, radio silence. I felt minor relief every day I didn't he",1,6.430027397,-0.102272727
ptsd,6l1lwg,"[0, 5]","It's been about a year and a half since the event that set my mental health for a loop. After going to group counseling for months with no improvement, I decided to seek out an individual therapist. I didn't get one until a almost year after the event its",0,8.239183673,0.024404762
anxiety,87l3pf,"[0, 5]",I don't know what to do right now. I'm having so much anxiety and I feel that there is no hope for me right now. It took a lot of effort to post this. I panic very easily. I also have trust issues.,1,1.495,0.333690476
ptsd,9clolq,"(0, 5)"," Two of my best friends for  the last 10 years are drifting away from me. I got diagnosed with PTSD  1¬Ω year ago, and back then they were very supportive. But in the last  6-9 months; in fact, almost ever since early retirement funded by the  government ",0,4.848908046,0.2375
